{
    "logFile": "./logs/bot.log",
    "importLogFile": "./logs/import.log",
    "eventsPath": "./src/events",
    "commandsPath": "./src/commands",
    "cliCommandsPath": "./src/commands/cli",
    "websocketCommandsPath": "./src/commands/websocket",
    "dbPath": "./db",
    "logLevel": "debug",
    "cmdPrefix": "%",
    "enableCliCommands": true,
    "cliCmdPrefix": ".",
    "enableWebsocket": true,
    "websocketPort": 8081,
    "outCharLimit": 2000,
    "outLineLimit": 16,
    "embedCharLimit": 3000,
    "embedLineLimit": 40,
    "minResponseTime": 0.1,
    "globalTimeLimit": 60,
    "commandWaitTime": 3,
    "reminderMsgLimit": 512,
    "reminderSendInterval": 10,
    "maxTagNameLength": 32,
    "tagNameRegex": "^[A-Za-z0-9\\-_]+$",
    "maxTagSize": 100,
    "maxQuota": 1024,
    "memLimit": 250,
    "timeLimit": 15,
    "otherMemLimit": 50,
    "otherTimeLimit": 15,
    "enableInspector": false,
    "enableUserInspector": false,
    "inspectorConnectTimeout": 60,
    "userInspectorConnectTimeout": 30,
    "userInspectorActionTimeout": 300,
    "inspectorPort": 8080,
    "maxGroupNameLength": 16,
    "tagModeratorLevel": 1,
    "permissionAdminLevel": 2,
    "enablePreviews": true,
    "enableSed": true,
    "enableEval": true,
    "enableOtherLangs": false,
    "enableVM2": false,
    "enablePermissions": true,
    "enableReminders": true,
    "enableGlobalHandler": true,
    "wrapEvents": true,
    "setActivity": false,
    "activity": {
        "type": "watching",
        "text": "example"
    },
    "mentionUsers": false,
    "pingReply": true,
    "logToDiscord": false,
    "discordLogLevel": "info",
    "logChannelId": "",
    "logWebhook": "",
    "emoji": {
        "info": ":information_source:",
        "warn": ":warning:",
        "error": ":no_entry_sign:",
        "ok": ":white_check_mark:",
        "invalid": ":police_car:",
        "waiting": ":hourglass_flowing_sand:"
    },
    "bridgeBotIds": [],
    "bridgeBotMessageFormat": "\\*{2}.+?:\\*{2}\\s"
}
